{
  "kernel": "sworncode",
  "profile": "commit-gate",
  "conformant": true,
  "counts": {
    "pass": 5,
    "fail": 0,
    "na": 9
  },
  "clauses": [
    {
      "id": "GAK-DENY-DEFAULT",
      "profile": "action-gate",
      "status": "NA",
      "detail": "out of profile (action-gate); kernel is commit-gate. An unknown/ungoverned action is denied by default."
    },
    {
      "id": "GAK-ALLOW-INBOUNDS",
      "profile": "action-gate",
      "status": "NA",
      "detail": "out of profile (action-gate); kernel is commit-gate. Legitimate in-sandbox work is ALLOWED (deny-everything is not conformance)."
    },
    {
      "id": "GAK-PATH-CONTAINMENT",
      "profile": "action-gate",
      "status": "NA",
      "detail": "out of profile (action-gate); kernel is commit-gate. A write escaping the sandbox is blocked."
    },
    {
      "id": "GAK-DESTRUCTIVE-FLOOR",
      "profile": "action-gate",
      "status": "NA",
      "detail": "out of profile (action-gate); kernel is commit-gate. An irreversible/destructive command is blocked regardless of allowlist."
    },
    {
      "id": "GAK-PROGRAM-ALLOWLIST",
      "profile": "action-gate",
      "status": "NA",
      "detail": "out of profile (action-gate); kernel is commit-gate. A non-allowlisted program is blocked."
    },
    {
      "id": "GAK-JAIL-FAILS-CLOSED",
      "profile": "action-gate",
      "status": "NA",
      "detail": "out of profile (action-gate); kernel is commit-gate. When no OS confinement is available, the jail refuses to run (never un-jailed)."
    },
    {
      "id": "GAK-CHAIN-INTACT",
      "profile": "universal",
      "status": "PASS",
      "detail": "An untampered audit chain re-verifies."
    },
    {
      "id": "GAK-TAMPER-EVIDENT",
      "profile": "universal",
      "status": "PASS",
      "detail": "A mutated audit record is detected (tamper-evident)."
    },
    {
      "id": "GAK-RECONCILE-UNDECLARED",
      "profile": "action-gate",
      "status": "NA",
      "detail": "out of profile (action-gate); kernel is commit-gate. A tool changing undeclared state is flagged (two-plane reconciliation)."
    },
    {
      "id": "GAK-ATTEST-HONEST",
      "profile": "universal",
      "status": "NA",
      "detail": "kernel does not claim 'attest'. The kernel ABSTAINS on coverage it did not earn (no false attestation)."
    },
    {
      "id": "GAK-COMMIT-DENY-SECURITY",
      "profile": "commit-gate",
      "status": "PASS",
      "detail": "A change-set touching a security surface (crypto/auth/keys/...) is blocked."
    },
    {
      "id": "GAK-COMMIT-ALLOW-CLEAN",
      "profile": "commit-gate",
      "status": "PASS",
      "detail": "A benign in-policy change-set is allowed (deny-everything is not conformance)."
    },
    {
      "id": "GAK-COMMIT-TESTIFIES",
      "profile": "commit-gate",
      "status": "PASS",
      "detail": "Every decision (ALLOW or BLOCK) is recorded to a verifiable audit log."
    },
    {
      "id": "GAK-AUDIT-CONTENT-BLIND",
      "profile": "universal",
      "status": "NA",
      "detail": "kernel does not claim 'content-blind-audit'. The durable audit record commits every decision (integrity re-verifies) yet the persisted record alone cannot reconstruct the governed request content."
    }
  ]
}
